{
  "required" : true ,
  "$schema" : "http://json-schema.org/draft-03/schema" ,
  "type" : "object" ,
  "properties" : {
    "api_token" : {
      "type" : "string" ,
      "required" : false
    } ,
    "created_at" : {
      "type" : "string" ,
      "required" : false
    } ,
    "email" : {
      "type" : "string" ,
      "required" : false
    } ,
    "has_google_identity" : {
      "type" : "boolean" ,
      "required" : false
    } ,
    "id" : {
      "type" : "number" ,
      "required" : false
    } ,
    "initials" : {
      "type" : "string" ,
      "required" : false
    } ,
    "kind" : {
      "type" : "string" ,
      "required" : false
    } ,
    "name" : {
      "type" : "string" ,
      "required" : false
    } ,
    "projects" : {
      "type" : "array" ,
      "required" : false ,
      "items" : [
        {
          "type" : "object" ,
          "properties" : {
            "kind" : {
              "type" : "string" ,
              "required" : false
            } ,
            "id" : {
              "type" : "number" ,
              "required" : false
            } ,
            "project_id" : {
              "type" : "number" ,
              "required" : false
            } ,
            "project_name" : {
              "type" : "string" ,
              "required" : false
            } ,
            "project_color" : {
              "type" : "string" ,
              "required" : false
            } ,
            "role" : {
              "type" : "string" ,
              "required" : false
            } ,
            "last_viewed_at" : {
              "type" : "string" ,
              "required" : false
            }
          }
        }
      ]
    } ,
    "receives_in_app_notifications" : {
      "type" : "boolean" ,
      "required" : false
    } ,
    "time_zone" : {
      "type" : "object" ,
      "required" : false ,
      "properties" : {
        "kind" : {
          "type" : "string" ,
          "required" : false
        } ,
        "olson_name" : {
          "type" : "string" ,
          "required" : false
        } ,
        "offset" : {
          "type" : "string" ,
          "required" : false
        }
      }
    } ,
    "updated_at" : {
      "type" : "string" ,
      "required" : false
    } ,
    "username" : {
      "type" : "string" ,
      "required" : false
    }
  }
}